{
  "schema_version": 1,
  "envelope_id": "env-0001",
  "subject": { "type": "task", "id": "task-123" },
  "snapshot": {
    "snapshot_id": "snap-0002",
    "revision": 2,
    "digest": "076888ef4c18be7d2dd664fc6b0ceefc0561cc2b558076973b62a2a086751b5b"
  },
  "proposal": {
    "proposal_id": "proposal-0002",
    "schema_version": 2,
    "decision": "REEXECUTE"
  },
  "policy": {
    "policy_decision_id": "policy:proposal-0002",
    "policy_version": "0.1.0",
    "verdict": "ALLOW"
  },
  "capability_validation": {
    "capability": "demo.verify",
    "admitted": true,
    "permitted": true,
    "reason": "capability 'demo.verify' v1 admitted within the semantic attempt bound"
  },
  "approvals": [],
  "outcome": "EXECUTABLE",
  "expiry": "2026-10-01T01:00:00Z",
  "intent": {
    "schema_version": 1,
    "intent_id": "intent:proposal-0002",
    "capability": "demo.verify",
    "target": { "type": "task", "id": "task-123" },
    "arguments": { "fail_until_attempt": 1 },
    "policy_context": { "snapshot_id": "snap-0002", "domain": "software" },
    "requested_by": { "provider": "rules.v1", "decision_id": "proposal-0002" }
  }
}
